{
  "$schema": "https://json-schema.org/draft/2020-12/schema",
  "title": "00-sections.json - A0 output",
  "type": "array",
  "items": {
    "type": [
      "object",
      "null"
    ],
    "properties": {
      "section_index": {
        "type": "integer"
      },
      "section_label": {
        "type": "string"
      },
      "section_type": {
        "type": [
          "string",
          "null"
        ],
        "enum": [
          "bibliographic",
          "abstract",
          "technical_field",
          "background",
          "summary_of_invention",
          "beneficial_effects",
          "formula_definitions",
          "description_of_drawings",
          "experimental_intermediate",
          "experimental_example",
          "comparative_example",
          "assay_data",
          "pharmaceutical_compositions",
          "claims",
          "search_report",
          "other",
          null
        ]
      },
      "start_line": {
        "type": "integer"
      },
      "end_line": {
        "type": "integer"
      },
      "heading_text_zh": {
        "type": [
          "string",
          "null"
        ]
      },
      "heading_text_en": {
        "type": [
          "string",
          "null"
        ]
      },
      "contains_procedure": {
        "type": "boolean"
      },
      "estimated_steps": {
        "type": "integer"
      },
      "notes": {
        "type": [
          "string",
          "null"
        ]
      }
    },
    "required": [
      "section_index",
      "section_label",
      "section_type",
      "start_line",
      "end_line",
      "contains_procedure"
    ],
    "additionalProperties": false
  }
}