[
  {
    "section_index": 0,
    "section_label": "Bibliographic",
    "section_type": "bibliographic",
    "start_line": 1,
    "end_line": 37,
    "heading_text_zh": null,
    "heading_text_en": null,
    "contains_procedure": false,
    "estimated_steps": 0,
    "notes": "Front page cover data: publication number, dates, application number, applicant, inventors, IPC classes, page counts, and the title at lines 34-37. Line 1 is the document title line and line 4 is the p01 page comment; both absorbed here per rule 8."
  },
  {
    "section_index": 1,
    "section_label": "Abstract",
    "section_type": "abstract",
    "start_line": 38,
    "end_line": 42,
    "heading_text_zh": "（57）摘要",
    "heading_text_en": "(57) Abstract",
    "contains_procedure": false,
    "estimated_steps": 0,
    "notes": "Names the two transformations of the route in prose but gives no quantities or operations, so it is not a procedure for A2."
  },
  {
    "section_index": 2,
    "section_label": "Claims",
    "section_type": "claims",
    "start_line": 43,
    "end_line": 79,
    "heading_text_zh": "权利要求书",
    "heading_text_en": "Claims",
    "contains_procedure": false,
    "estimated_steps": 0,
    "notes": "Claims 1-10. Carries the same two reaction schemes as the summary, as IMAGE_EXTRACT spans at lines 49 and 53; they are claim-scope drawings, not procedures, so contains_procedure is false to avoid A2 double counting them. Claim 10 breaks across the p03 page boundary and its ratio value is completed by the stray '1。' at line 78; the p03 page comment at line 76 and the surrounding blanks are absorbed here per rule 8."
  },
  {
    "section_index": 3,
    "section_label": "Technical Field",
    "section_type": "technical_field",
    "start_line": 80,
    "end_line": 84,
    "heading_text_zh": null,
    "heading_text_en": null,
    "contains_procedure": false,
    "estimated_steps": 0,
    "notes": "Paragraph [0001]. The 技术领域 heading is not printed in this transcription; the field orientation is identified by content per rule 4. The p04 page comment at line 81 is absorbed here."
  },
  {
    "section_index": 4,
    "section_label": "Background",
    "section_type": "background",
    "start_line": 85,
    "end_line": 88,
    "heading_text_zh": null,
    "heading_text_en": null,
    "contains_procedure": true,
    "estimated_steps": 2,
    "notes": "Paragraphs [0002]-[0003]. No 背景技术 heading is printed; identified by content. Describes the prior-art industrial route: trifluoroethanol plus potassium tert-butoxide to the key intermediate, then acyl chlorination / esterification / rearrangement with acetone cyanohydrin and thionyl chloride. Typed background per rule 11, but flagged as containing two extractable prior-art steps with named reagents and no quantities."
  },
  {
    "section_index": 5,
    "section_label": "Summary of the Invention",
    "section_type": "summary_of_invention",
    "start_line": 89,
    "end_line": 127,
    "heading_text_zh": null,
    "heading_text_en": null,
    "contains_procedure": true,
    "estimated_steps": 2,
    "notes": "Paragraphs [0004]-[0020]: object of the invention, the two-step technical solution (step a and step b) with the reaction schemes drawn at lines 98 and 103, then the dependent parameter ranges (molar ratios, temperatures, times, base catalysts, condensing agents, solvents). Two generic steps, given as ranges rather than a single charged procedure. The p05 page comment at line 110 sits inside this section and is not a boundary."
  },
  {
    "section_index": 6,
    "section_label": "Beneficial Effects",
    "section_type": "beneficial_effects",
    "start_line": 128,
    "end_line": 129,
    "heading_text_zh": null,
    "heading_text_en": null,
    "contains_procedure": false,
    "estimated_steps": 0,
    "notes": "Paragraph [0021], the explicit advantages over the prior art. Printed without a 有益效果 heading and immediately after the parameter list, so its separation from the summary is a judgement call on content: it makes no technical-solution statement and only compares against prior art."
  },
  {
    "section_index": 7,
    "section_label": "Detailed Description Lead-in",
    "section_type": "other",
    "start_line": 130,
    "end_line": 133,
    "heading_text_zh": "具体实施方式",
    "heading_text_en": "Detailed description of the embodiments",
    "contains_procedure": false,
    "estimated_steps": 0,
    "notes": "The 具体实施方式 heading plus boilerplate paragraph [0022] introducing the examples. No specific type in the closed list fits a bare examples lead-in, so it is other rather than being folded into Example 1, which would give Example 1 text it does not own."
  },
  {
    "section_index": 8,
    "section_label": "Example 1",
    "section_type": "experimental_example",
    "start_line": 134,
    "end_line": 141,
    "heading_text_zh": "实施例1",
    "heading_text_en": "Example 1",
    "contains_procedure": true,
    "estimated_steps": 2,
    "notes": "Paragraphs [0023]-[0026]. One section spanning both numbered steps per rule 6. Step a: sodium trifluoroethoxide, sodium hydroxide, compound I in DMF, 30 degrees C for 5 h, 314.8 g of compound II, 91 percent. Step b: compound II with 1,3-cyclohexanedione, CDI and triethylamine in 1,2-dichloroethane at 5-10 degrees C for 8 h, 366.4 g, purity 96.5 percent, 86.3 percent. Both steps also list alternative solvents inline."
  },
  {
    "section_index": 9,
    "section_label": "Example 2",
    "section_type": "experimental_example",
    "start_line": 142,
    "end_line": 152,
    "heading_text_zh": "实施例2",
    "heading_text_en": "Example 2",
    "contains_procedure": true,
    "estimated_steps": 2,
    "notes": "Paragraphs [0027]-[0030]. Step a uses potassium hydroxide, 0 degrees C for 10 h, 93 percent; step b uses HBTU and sodium carbonate in dichloromethane at 8-15 degrees C for 9 h, 86 percent. The p06 page comment at line 143 is absorbed here."
  },
  {
    "section_index": 10,
    "section_label": "Example 3",
    "section_type": "experimental_example",
    "start_line": 153,
    "end_line": 160,
    "heading_text_zh": "实施例3",
    "heading_text_en": "Example 3",
    "contains_procedure": true,
    "estimated_steps": 2,
    "notes": "Paragraphs [0031]-[0034]. Step a uses sodium carbonate, 50 degrees C for 2 h, 90 percent; step b uses HOBT and calcium hydroxide in dichloroethane at 15-20 degrees C for 8 h, 87.5 percent."
  },
  {
    "section_index": 11,
    "section_label": "Example 4",
    "section_type": "experimental_example",
    "start_line": 161,
    "end_line": 168,
    "heading_text_zh": "实施例4",
    "heading_text_en": "Example 4",
    "contains_procedure": true,
    "estimated_steps": 2,
    "notes": "Paragraphs [0035]-[0038]. Step a uses potassium carbonate, 30 degrees C for 5 h, 93 percent; step b uses DBU and pyridine in cyclohexane at -10 to 8 degrees C for 24 h, 80.1 percent."
  },
  {
    "section_index": 12,
    "section_label": "Example 5",
    "section_type": "experimental_example",
    "start_line": 169,
    "end_line": 181,
    "heading_text_zh": "实施例5",
    "heading_text_en": "Example 5",
    "contains_procedure": true,
    "estimated_steps": 2,
    "notes": "Paragraphs [0039]-[0042]. Step a uses lithium hydroxide, 30 degrees C for 5 h, 92 percent, and its sentence breaks across the p07 page boundary: the charge is at line 173 and the workup continues at line 178, so the p07 page comment at line 176 is inside this section and not a boundary. Step b uses CDI and potassium carbonate in cyclohexane at 20-30 degrees C for 15 h, 83.9 percent."
  },
  {
    "section_index": 13,
    "section_label": "Closing Statement",
    "section_type": "other",
    "start_line": 182,
    "end_line": 183,
    "heading_text_zh": null,
    "heading_text_en": null,
    "contains_procedure": false,
    "estimated_steps": 0,
    "notes": "Paragraph [0043], the standard closing statement that the examples do not limit the scope, together with its EN gloss at line 183. No chemistry. This is the last line of the document: line 183 carries no trailing newline, so wc -l reports 182, but the pipeline reads line numbers off the NNNN | prefix and sees all 183."
  }
]
